{
  "schema": "nekkora-rpa/selectors",
  "version": "1.0.0",
  "system": "adv",
  "targets": {
    "adv.salvar": {"page": "resolver", "preferred": {"strategy": "css", "expression": "#salvar"},
                   "expected": {"tag": "button", "role": "button", "name": "Salvar"}},
    "adv.salvar_xpath": {"preferred": {"strategy": "xpath", "expression": "//button[@id='salvar']"},
                         "expected": {"tag": "button", "role": "button", "name": "Salvar"}},
    "adv.salvar_id": {"preferred": {"strategy": "id", "value": "salvar"},
                      "expected": {"tag": "button", "role": "button", "name": "Salvar"}},
    "adv.salvar_role": {"preferred": {"strategy": "role", "role": "button", "name": "Salvar"},
                        "expected": {"tag": "button", "role": "button", "name": "Salvar"}},
    "adv.salvar_alt_ok": {"preferred": {"strategy": "css", "expression": "#salvar-antigo"},
                          "alternatives": [{"strategy": "role", "role": "button", "name": "Salvar"}],
                          "expected": {"tag": "button", "role": "button", "name": "Salvar"}},
    "adv.salvar_disagree": {"preferred": {"strategy": "css", "expression": "#salvar"},
                            "alternatives": [{"strategy": "css", "expression": "#contador"}],
                            "expected": {"tag": "button", "role": "button", "name": "Salvar"}},
    "adv.contador": {"preferred": {"strategy": "id", "value": "contador"},
                     "expected": {"tag": "button", "role": "button", "name": "Contar"}},
    "adv.cliques": {"preferred": {"strategy": "id", "value": "cliques"}, "expected": {"tag": "span"}},
    "adv.duplicado": {"preferred": {"strategy": "test_id", "value": "duplicado"},
                      "expected": {"tag": "button", "role": "button", "name": "Duplicado"}},
    "adv.enviar_por_papel": {"preferred": {"strategy": "role", "role": "button", "name": "Enviar"},
                             "expected": {"tag": "button", "role": "button", "name": "Enviar"}},
    "adv.enviar_real": {"preferred": {"strategy": "css", "expression": "#enviar-real"},
                        "expected": {"tag": "button", "role": "button", "name": "Enviar"}},
    "adv.enviar_real_alt_sosia": {"preferred": {"strategy": "css", "expression": "#enviar-real"},
                                  "alternatives": [{"strategy": "role", "role": "button", "name": "Enviar"}],
                                  "expected": {"tag": "button", "role": "button", "name": "Enviar"}},
    "adv.excluir": {"preferred": {"strategy": "css", "expression": "#excluir"},
                    "expected": {"tag": "button", "role": "button", "name": "Excluir"}},
    "adv.link_como_botao": {"preferred": {"strategy": "css", "expression": "#link-falso"},
                            "expected": {"tag": "button"}},
    "adv.campo_texto": {"preferred": {"strategy": "id", "value": "campo-texto"},
                        "expected": {"tag": "input", "type": "text", "role": "textbox", "name": "Nome"}},
    "adv.campo_por_name": {"preferred": {"strategy": "name", "value": "nome"},
                           "expected": {"tag": "input", "type": "text", "role": "textbox", "name": "Nome"}},
    "adv.campo_tipo_errado": {"preferred": {"strategy": "id", "value": "campo-texto"},
                              "expected": {"tag": "input", "type": "password"}},
    "adv.campo_ro": {"preferred": {"strategy": "id", "value": "campo-ro"},
                     "expected": {"tag": "input", "role": "textbox", "name": "Somente leitura"}},
    "adv.campo_desab": {"preferred": {"strategy": "id", "value": "campo-desab"},
                        "expected": {"tag": "input", "role": "textbox", "name": "Desabilitado"}},
    "adv.campo_maiusculo": {"preferred": {"strategy": "id", "value": "campo-maiusculo"},
                            "expected": {"tag": "input", "role": "textbox", "name": "Maiúsculo"}},
    "adv.campo_senha": {"preferred": {"strategy": "id", "value": "campo-senha"},
                        "expected": {"tag": "input", "type": "password"}},
    "adv.tardio": {"preferred": {"strategy": "css", "expression": "#tardio"},
                   "expected": {"tag": "button", "role": "button", "name": "Tardio"}},
    "adv.habilita": {"preferred": {"strategy": "id", "value": "habilita"},
                     "expected": {"tag": "button", "role": "button", "name": "Habilita"}},
    "adv.sempre_desab": {"preferred": {"strategy": "id", "value": "sempre-desab"},
                         "expected": {"tag": "button", "role": "button", "name": "Nunca habilita"}},
    "adv.coberto": {"preferred": {"strategy": "id", "value": "coberto"},
                    "expected": {"tag": "button", "role": "button", "name": "Coberto"}},
    "adv.coberto_temp": {"preferred": {"strategy": "id", "value": "coberto-temp"},
                         "expected": {"tag": "button", "role": "button", "name": "Coberto por instantes"}},
    "adv.sombra": {"preferred": {"strategy": "css", "expression": "#sombra"},
                   "expected": {"tag": "button", "role": "button", "name": "Sombra"}},
    "adv.no_frame": {"preferred": {"strategy": "css", "expression": "#no-frame"},
                     "expected": {"tag": "button", "role": "button", "name": "No frame"}},
    "adv.inexistente": {"preferred": {"strategy": "css", "expression": "#nao-existe"},
                        "expected": {"tag": "button"}},
    "adv.nova_aba": {"preferred": {"strategy": "id", "value": "nova-aba"},
                     "expected": {"tag": "a", "role": "link", "name": "Abrir nova aba"}},
    "adv.mudar_rota": {"preferred": {"strategy": "id", "value": "mudar-rota"},
                       "expected": {"tag": "a", "role": "link", "name": "Mudar rota"}},
    "adv.link_redir": {"preferred": {"strategy": "id", "value": "link-redir"},
                       "expected": {"tag": "a", "role": "link", "name": "Redirecionar"}},
    "adv.ir_externo": {"preferred": {"strategy": "id", "value": "ir-externo"},
                       "expected": {"tag": "button", "role": "button", "name": "Ir para externo"}},
    "adv.nova_aba_externa": {"preferred": {"strategy": "id", "value": "nova-aba-externa"},
                             "expected": {"tag": "a", "role": "link", "name": "Abrir externo em nova aba"}},
    "adv.destino": {"preferred": {"strategy": "id", "value": "destino"},
                    "expected": {"tag": "h1", "role": "heading", "name": "Destino"}},
    "adv.capa_temp": {"preferred": {"strategy": "id", "value": "capa-temp"}, "expected": {"tag": "div"}},
    "adv.fecha": {"preferred": {"strategy": "id", "value": "fecha"},
                  "expected": {"tag": "button", "role": "button", "name": "Registrar e fechar"}},
    "adv.efeito_lento": {"preferred": {"strategy": "id", "value": "efeito-lento"},
                         "expected": {"tag": "button", "role": "button", "name": "Registrar devagar"}},
    "adv.titulo": {"preferred": {"strategy": "id", "value": "titulo-adv"},
                   "expected": {"tag": "h1", "role": "heading", "name": "Cenários adversariais"}}
  }
}
